[
  {
    "stage": "gate",
    "severity": "high",
    "artifact_ref": "permissions.json",
    "message": "The request context key aws-marketplace:ProductId has multiple values. Use the ForAllValues or ForAnyValue condition key qualifiers in your policy. [MISSING_QUALIFIER] See: https://docs.aws.amazon.com/IAM/latest/UserGuide/access-analyzer-reference-policy-checks.html#access-analyzer-reference-policy-checks-error-missing-qualifier",
    "verification": "proof-backed"
  },
  {
    "stage": "gate",
    "severity": "high",
    "artifact_ref": "boundary.json",
    "message": "The request context key aws-marketplace:ProductId has multiple values. Use the ForAllValues or ForAnyValue condition key qualifiers in your policy. [MISSING_QUALIFIER] See: https://docs.aws.amazon.com/IAM/latest/UserGuide/access-analyzer-reference-policy-checks.html#access-analyzer-reference-policy-checks-error-missing-qualifier",
    "verification": "proof-backed"
  },
  {
    "stage": "gate",
    "severity": "high",
    "artifact_ref": "delegation_template (iam:PermissionsBoundary condition)",
    "message": "Boundary ARN domain mismatch: template references domain 'partner10.com' but metadata declares partner_domain 'app.partner-10.io'. This may enforce another partner's boundary. Expected: 'arn:aws:iam::partner:policy/permissions-boundary/app.partner-10.io/MarketplaceBuyerRoleBoundary_2026_07_06'.",
    "verification": "proof-backed"
  }
]
